{
  "$schema": "https://tadpoleos.dev/schemas/swarm-v1.json",
  "name": "Creative Asset Pipeline Swarm",
  "version": "1.0.0",
  "author": "PixelStream Studios",
  "description": "Designed for creative asset verification, size budget checks, and dialog localization tracking.",
  "industry": "Media & Creative",
  "tags": [
    "creative",
    "media",
    "assets",
    "localization"
  ],
  "defaults": {
    "model": "gemini-1.5-flash",
    "temperature": 0.3
  },
  "roster": [
    {
      "id": "paid-media-paid-media-auditor",
      "path": "agents/paid-media-paid-media-auditor.json",
      "supervisor": null,
      "priority": "critical"
    },
    {
      "id": "paid-media-paid-media-creative-strategist",
      "path": "agents/paid-media-paid-media-creative-strategist.json",
      "supervisor": null,
      "priority": "normal"
    },
    {
      "id": "finance-finance-investment-researcher",
      "path": "agents/finance-finance-investment-researcher.json",
      "supervisor": null,
      "priority": "normal"
    }
  ],
  "global_workflows": []
}
