{
  "$schema": "https://tadpoleos.dev/schemas/swarm-v1.json",
  "name": "Curriculum Planner Swarm",
  "version": "1.0.0",
  "author": "EdTech Solutions",
  "description": "Designed for curriculum audit mapping, lesson plan alignment, and student analytics reviews.",
  "industry": "Education",
  "tags": [
    "education",
    "curriculum",
    "analytics"
  ],
  "defaults": {
    "model": "gemma4:31b",
    "temperature": 0.3
  },
  "roster": [
    {
      "id": "engineering-engineering-data-engineer",
      "path": "agents/engineering-engineering-data-engineer.json",
      "supervisor": null,
      "priority": "critical"
    },
    {
      "id": "finance-finance-bookkeeper-controller",
      "path": "agents/finance-finance-bookkeeper-controller.json",
      "supervisor": null,
      "priority": "normal"
    },
    {
      "id": "gis-gis-bim-specialist",
      "path": "agents/gis-gis-bim-specialist.json",
      "supervisor": null,
      "priority": "normal"
    }
  ],
  "global_workflows": []
}
