{
  "$schema": "https://tadpoleos.dev/schemas/swarm-v1.json",
  "name": "Studio Delivery & Release Desk",
  "version": "1.0.0",
  "description": "Software Studio: Client ticket triage, changelog release writing, and scope change-order drafting.",
  "industry": "software-development",
  "tags": [
    "development",
    "api",
    "documentation",
    "synthesis"
  ],
  "defaults": {
    "model": "gemma4:31b",
    "temperature": 0.2
  },
  "roster": [
    {
      "id": "project-management-ticket-triage-pm",
      "path": "agents/project-management-ticket-triage-pm.json",
      "supervisor": null,
      "priority": "normal"
    },
    {
      "id": "support-customer-release-writer",
      "path": "agents/support-customer-release-writer.json",
      "supervisor": null,
      "priority": "normal"
    },
    {
      "id": "sales-quote-proposal-drafter",
      "path": "agents/sales-quote-proposal-drafter.json",
      "supervisor": null,
      "priority": "normal"
    }
  ],
  "required_mcps": "mcps.json",
  "agents": [
    "project-management-ticket-triage-pm",
    "support-customer-release-writer",
    "sales-quote-proposal-drafter"
  ]
}
