{
  "$schema": "https://tadpoleos.dev/schemas/swarm-v1.json",
  "name": "SEO Content Strategy Indexer",
  "version": "1.0.0",
  "description": "Knowledge Work: Web scraping, SEO keyword trend analysis, search intent mapping, and strategy synthesis.",
  "industry": "digital-marketing",
  "tags": [
    "marketing",
    "seo",
    "content-strategy",
    "synthesis"
  ],
  "defaults": {
    "model": "gemma4:31b",
    "temperature": 0.2
  },
  "roster": [
    {
      "id": "paid-media-paid-media-search-query-analyst",
      "path": "agents/paid-media-paid-media-search-query-analyst.json",
      "supervisor": null,
      "priority": "critical"
    },
    {
      "id": "marketing-marketing-baidu-seo-specialist",
      "path": "agents/marketing-marketing-baidu-seo-specialist.json",
      "supervisor": null,
      "priority": "normal"
    },
    {
      "id": "marketing-marketing-seo-specialist",
      "path": "agents/marketing-marketing-seo-specialist.json",
      "supervisor": null,
      "priority": "normal"
    }
  ],
  "required_mcps": "mcps.json",
  "global_workflows": [
    "workflows/seo_sop.md"
  ]
}
