{
  "$schema": "https://tadpoleos.dev/schemas/swarm-v1.json",
  "name": "Subcontractor Procurement & QA",
  "version": "1.0.0",
  "description": "Edge Operations: Consultant onboarding procurement, shipping materials, project timesheet QA, and ISO compliance.",
  "industry": "specialized-consultancies",
  "tags": [
    "consultancy",
    "procurement",
    "timesheet-qa",
    "iso9000"
  ],
  "defaults": {
    "model": "gemma4:31b",
    "temperature": 0.2
  },
  "roster": [
    {
      "id": "specialized-government-digital-presales-consultant",
      "path": "agents/specialized-government-digital-presales-consultant.json",
      "supervisor": null,
      "priority": "critical"
    },
    {
      "id": "specialized-hr-onboarding",
      "path": "agents/specialized-hr-onboarding.json",
      "supervisor": null,
      "priority": "normal"
    },
    {
      "id": "specialized-recruitment-specialist",
      "path": "agents/specialized-recruitment-specialist.json",
      "supervisor": null,
      "priority": "normal"
    }
  ],
  "required_mcps": "mcps.json",
  "global_workflows": [
    "workflows/subcontractor_sop.md"
  ]
}
