{
  "$schema": "https://tadpoleos.dev/schemas/swarm-v1.json",
  "id": "bookkeeping-audit",
  "name": "Bookkeeping & Cash Operations Swarm",
  "industry": "Financial Services",
  "company_size": 50,
  "description": "Financial Operations: General ledger reconciliation, AP/AR cash flow, and client document collection.",
  "author": "AI-Tadpole-OS",
  "tags": [
    "finance",
    "accounting",
    "tax",
    "audit"
  ],
  "path": "financial-services/bookkeeping-audit",
  "agents": [
    "finance-finance-bookkeeper-controller",
    "finance-ar-collections-specialist",
    "support-client-document-coordinator"
  ],
  "version": "1.0.0",
  "roster": [
    {
      "id": "finance-finance-bookkeeper-controller",
      "path": "agents/finance-finance-bookkeeper-controller.json",
      "supervisor": null,
      "priority": "normal"
    },
    {
      "id": "finance-ar-collections-specialist",
      "path": "agents/finance-ar-collections-specialist.json",
      "supervisor": null,
      "priority": "normal"
    },
    {
      "id": "support-client-document-coordinator",
      "path": "agents/support-client-document-coordinator.json",
      "supervisor": null,
      "priority": "normal"
    }
  ],
  "defaults": {
    "model": "gemma4:31b",
    "temperature": 0.2
  }
}
