{
  "$schema": "https://tadpoleos.dev/schemas/swarm-v1.json",
  "name": "Harvest Shipping & Equipment Parts Inventory",
  "version": "1.0.0",
  "description": "Edge Operations: Bulk crop shipping logistics, receiving farming parts, and equipment maintenance QA.",
  "industry": "agriculture-agtech",
  "tags": [
    "agriculture",
    "shipping",
    "inventory",
    "logistics",
    "maintenance-qa"
  ],
  "defaults": {
    "model": "gemma4:31b",
    "temperature": 0.2
  },
  "roster": [
    {
      "id": "marketing-marketing-cross-border-ecommerce",
      "path": "agents/marketing-marketing-cross-border-ecommerce.json",
      "supervisor": null,
      "priority": "critical"
    },
    {
      "id": "design-design-brand-guardian",
      "path": "agents/design-design-brand-guardian.json",
      "supervisor": null,
      "priority": "normal"
    },
    {
      "id": "engineering-engineering-devops-automator",
      "path": "agents/engineering-engineering-devops-automator.json",
      "supervisor": null,
      "priority": "normal"
    }
  ],
  "required_mcps": "mcps.json",
  "global_workflows": [
    "workflows/grain_shipping_sop.md"
  ]
}
