{
  "$schema": "https://tadpoleos.dev/schemas/swarm-v1.json",
  "name": "Commercial Jobsite & Subcontractor Operations",
  "version": "1.0.0",
  "author": "AI-Tadpole-OS Core Team",
  "description": "Construction: Daily jobsite safety compliance, subcontractor milestone tracking, OSHA hazard logs, and AIA pay-application auditing.",
  "industry": "Construction & General Contracting",
  "tags": [
    "construction",
    "safety",
    "subcontractors",
    "osha",
    "milestones"
  ],
  "defaults": {
    "model": "gemma4:31b",
    "temperature": 0.2
  },
  "roster": [
    {
      "id": "construction-safety-officer",
      "path": "agents/construction-safety-officer.json",
      "supervisor": null,
      "priority": "critical"
    },
    {
      "id": "construction-subcontractor-coordinator",
      "path": "agents/construction-subcontractor-coordinator.json",
      "supervisor": null,
      "priority": "normal"
    },
    {
      "id": "construction-materials-takeoff-specialist",
      "path": "agents/construction-materials-takeoff-specialist.json",
      "supervisor": null,
      "priority": "normal"
    }
  ],
  "agents": [
    "construction-safety-officer",
    "construction-subcontractor-coordinator",
    "construction-materials-takeoff-specialist"
  ]
}
